Article,Summary
"On Saturday evening, Siddhartha Kala Peetham organized a cultural program at the Siddhartha Auditorium, which featured the mythological dance ballet 'Ksheera Sagara Madhanam.' The ballet, which depicted the story of the churning of the ocean (Samudra Manthan), was presented by Balatripura Sundari, daughter of the legendary Dr. Vempati Chinna Satyam. Trained under her father, Sundari carried forward his legacy through her dance school, Abhinayavam Net. The ballet, written by Devulapalli Krishna Sastry, had music composed by Dr. Bulantrapu Rajamkanta Rao. The performances of Lakshmi and Mohini were particularly noted for their grace and received much appreciation. Chavali Balatripura Sundari was honored for her exceptional contributions, with vocal performances from DNB Sastry and Darbha Mruduravali and instrumental accompaniment from K Rajagopalachari, Balasubramaniam, VBS Murali, and Sasidhar.","The cultural program 'Ksheera Sagara Madhanam,' presented by Balatripura Sundari, showcased the mythological story of the churning of the ocean. Sundari, daughter of Dr. Vempati Chinna Satyam, carried on her father's legacy through this performance. The ballet was well-received for the grace of the Lakshmi and Mohini characters. Sundari was honored for her contribution, and the program featured exceptional music and dance."
"Chhanpat Zakir, a resident of Khader Vall village in the Chapad mandal of VSI district, was arrested for his involvement in the illegal smuggling of red sanders. Zakir, a notorious smuggler, was apprehended following a thorough investigation led by Dr. Sida Cherluel. The accused was transferred to the Kadapa Central Jail as per court directives. Zakir violated forest and wildlife regulations, jeopardizing public order and exploiting valuable natural resources. Authorities invoked the Preventive Detention Act (PDA) to ensure the proper investigation and prosecution of the offender. The case highlights the growing need for forest conservation and emphasizes the importance of protecting valuable natural resources.","Chhanpat Zakir, a notorious red sanders smuggler, was arrested for violating forest and wildlife regulations. He was transferred to Kadapa Central Jail, and authorities invoked the Preventive Detention Act to ensure a proper investigation. The case underscores the importance of forest conservation and protecting valuable natural resources."
"India and Kuwait have elevated their bilateral ties to a strategic level following talks between Prime Minister Narendra Modi and the Emir of Kuwait. The two nations share a multifaceted relationship rooted in history, with discussions focused on enhancing cooperation in various sectors. During the meeting, Prime Minister Modi was conferred with the prestigious ‘Order of Mubarak Al Kabeer’ by the Amir of Kuwait. Additionally, Modi held wide-ranging talks with Kuwaiti officials, including the Prime Minister and Foreign Minister, to further strengthen diplomatic and economic ties between the two countries.",India and Kuwait have upgraded their relationship to a strategic level after talks between Prime Minister Modi and the Emir of Kuwait. Modi was awarded the ‘Order of Mubarak Al Kabeer’ and held discussions with Kuwaiti officials to enhance bilateral cooperation.
"The NDA will contest the Assembly elections in Bihar next year under the leadership of Chief Minister Nitish Kumar, according to Deputy Chief Minister and BJP leader Samrat Choudhary. He clarified that there was no confusion regarding Kumar’s leadership after speculation arose from Union Home Minister Amit Shah’s recent interview, where he suggested that the NDA might not project a chief ministerial candidate for the 2025 polls. Choudhary firmly dismissed the speculation, stating that the NDA is committed to contesting the elections under the leadership of both Nitish Kumar and Prime Minister Narendra Modi. The elections for Bihar's 243-member Assembly are scheduled for late 2025.","The NDA will fight the 2025 Bihar Assembly elections under the leadership of Nitish Kumar, despite speculation following Amit Shah’s comments. Deputy CM Samrat Choudhary confirmed that the NDA is committed to Kumar’s leadership and will continue to contest the elections with both Nitish Kumar and PM Modi leading the alliance."
"Chinese Foreign Minister Wang Yi stated that China and India should support each other, emphasizing the importance of cooperation over competition. In his annual press conference, Wang highlighted the importance of both nations working together for mutual success, instead of undermining one another. This comes after a four-year stalemate in bilateral relations. Wang stressed that the two countries should continue normalizing their relationship and fostering trust. He acknowledged that the boundary issue should not overshadow the broader partnership, and this year marks the 75th anniversary of China-India diplomatic ties. Wang concluded that a cooperative path was the only correct choice for both countries, referencing ongoing discussions between their national security advisors and foreign ministers to enhance relations.","Chinese Foreign Minister Wang Yi emphasized cooperation between China and India, stating that both countries should support each other rather than undermine each other. Reflecting on the 75th anniversary of diplomatic ties, he discussed normalizing relations and improving trust. Wang also noted that the boundary issue should not overshadow the broader bilateral partnership and called for a cooperative approach moving forward."
